<?xml version="1.0"?>
<statemachine
    xmlns="spryker:oms-01"
    xmlns:xsi="http://www.w3.org/2001/XMLSchema-instance"
    xsi:schemaLocation="spryker:oms-01 http://static.spryker.com/oms-01.xsd"
>

    <process name="Test07" main="true">

        <states>
            <state name="new" reserved="true"/>
            <state name="started" reserved="true"/>
            <state name="cancelled"/>
        </states>

        <transitions>
            <transition happy="true">
                <source>new</source>
                <target>started</target>
                <event>start</event>
            </transition>

            <transition>
                <source>new</source>
                <target>cancelled</target>
                <event>cancel</event>
            </transition>
        </transitions>

        <events>
            <event name="start" onEnter="true"/>
            <event name="cancel" manual="true"/>
        </events>
    </process>

</statemachine>
