<?xml version="1.0"?>
<statemachine
    xmlns="spryker:oms-01"
    xmlns:xsi="http://www.w3.org/2001/XMLSchema-instance"
    xsi:schemaLocation="spryker:oms-01 http://static.spryker.com/oms-01.xsd"
>

    <process name="ActiveSubProcess">

        <states>
            <state name="returned" display="sub process state display value"/>
            <state name="refunded"/>
        </states>

        <transitions>
            <transition>
                <source>paid</source>
                <target>returned</target>
                <event>return</event>
            </transition>

            <transition>
                <source>returned</source>
                <target>refunded</target>
                <event>refund</event>
            </transition>
        </transitions>

        <events>
            <event name="return" manual="true"/>
            <event name="refund" manual="true"/>
        </events>
    </process>

</statemachine>
