<?xml version="1.0"?>
<statemachine
    xmlns="spryker:oms-01"
    xmlns:xsi="http://www.w3.org/2001/XMLSchema-instance"
    xsi:schemaLocation="spryker:oms-01 http://static.spryker.com/oms-01.xsd"
>

    <process name="ActiveStateMachine" main="true">
        <subprocesses>
            <process>ActiveSubProcess</process>
        </subprocesses>

        <states>
            <state name="new" reserved="true" display="name display value"/>
            <state name="payment pending" reserved="true"/>
            <state name="paid"/>
        </states>

        <transitions>
            <transition>
                <source>new</source>
                <target>payment pending</target>
                <event>authorize</event>
            </transition>

            <transition>
                <source>payment pending</source>
                <target>paid</target>
                <event>pay</event>
            </transition>

        </transitions>

        <events>
            <event name="authorize" onEnter="true"/>
            <event name="pay" manual="true"/>
        </events>
    </process>

    <process name="ActiveSubProcess" file="Sub/ActiveSubProcess.xml"/>

</statemachine>
