<?xml version="1.0"?>
<statemachine
    xmlns="spryker:oms-01"
    xmlns:xsi="http://www.w3.org/2001/XMLSchema-instance"
    xsi:schemaLocation="spryker:oms-01 http://static.spryker.com/oms-01.xsd"
>

    <process name="Test02" main="true">

        <states>
            <state name="new" reserved="true"/>
            <state name="payment pending" reserved="true"/>
            <state name="invalid">
                <flag>exclude from customer</flag>
            </state>
            <state name="cancelled">
                <flag>exclude from customer</flag>
            </state>
            <state name="paid" reserved="true"/>
            <state name="exported" reserved="true"/>
            <state name="shipped" reserved="true"/>
            <state name="delivered"/>
            <state name="closed"/>
        </states>

        <transitions>
            <transition happy="true">
                <source>new</source>
                <target>payment pending</target>
                <event>authorize</event>
            </transition>

            <transition>
                <source>new</source>
                <target>invalid</target>
                <event>authorization-failed</event>
            </transition>

            <transition>
                <source>payment pending</source>
                <target>cancelled</target>
                <event>pay</event>
            </transition>

            <transition happy="true">
                <source>paid</source>
                <target>exported</target>
                <event>export</event>
            </transition>

            <transition happy="true">
                <source>exported</source>
                <target>shipped</target>
                <event>ship</event>
            </transition>

            <transition happy="true">
                <source>shipped</source>
                <target>delivered</target>
                <event>stock-update</event>
            </transition>

            <transition happy="true">
                <source>delivered</source>
                <target>closed</target>
                <event>close</event>
            </transition>

        </transitions>

        <events>
            <event name="authorize" manual="true"/>
            <event name="authorization-failed" manual="true"/>
            <event name="pay" manual="true" timeout="1 hour"/>
            <event name="export" manual="true"/>
            <event name="ship" manual="true"/>
            <event name="stock-update" manual="true"/>
            <event name="close" manual="true" timeout="1 hour"/>
            <event name="return" manual="true"/>
        </events>
    </process>

</statemachine>
